{
  "schema_version": "1.0",
  "challenge_id": "behavior-demo-001",
  "package": "code",
  "mode": "adversarial",
  "target": {
    "statement": "The declared behavior survives the supplied black-box probes.",
    "kind": "behavioral"
  },
  "evidence": [
    {"id": "black-box-traces", "type": "trace", "status": "pass", "formal": false},
    {"id": "fuzz-summary", "type": "test-summary", "status": "pass", "formal": false}
  ],
  "obligations": [
    {"id": "structure", "status": "pass"},
    {"id": "target", "status": "pass"},
    {"id": "evidence", "status": "pass"}
  ],
  "negative_controls": [
    {"id": "known-bad-fixture", "status": "pass"}
  ],
  "flow": {
    "enabled": true,
    "probes": [
      {"order": 0, "target_visible": false},
      {"order": 1, "target_visible": false},
      {"order": 2, "target_visible": true},
      {"order": 3, "target_visible": true}
    ],
    "first_recognition_order": 2,
    "bilateral": {"defect": 0.002, "tolerance": 0.01},
    "remainder_bound": 0.05
  }
}
